[
  {
    "schemaVersion": "adaptive-runtime-stage1-axis-decision-v1",
    "epochRowId": "campaign-1|run-1|cell-1|sample-1|connection-1|0",
    "campaignId": "campaign-1",
    "runId": "run-1",
    "cellId": "cell-1",
    "sampleId": "sample-1",
    "connectionKey": "connection-1",
    "epochIndex": 0,
    "axisId": "application_send_turn_planning",
    "decisionSequence": 1,
    "recordKind": "construction",
    "operationKey": null,
    "planKey": null,
    "forcedValue": null,
    "selectedValue": "conservative",
    "appliedValue": "legacy_current",
    "sourceArtifactPath": "raw/send-turn-decision.json",
    "sourceArtifactSha256": "5555555555555555555555555555555555555555555555555555555555555555"
  },
  {
    "schemaVersion": "adaptive-runtime-stage1-axis-decision-v1",
    "epochRowId": "campaign-1|run-1|cell-1|sample-1|connection-1|0",
    "campaignId": "campaign-1",
    "runId": "run-1",
    "cellId": "cell-1",
    "sampleId": "sample-1",
    "connectionKey": "connection-1",
    "epochIndex": 0,
    "axisId": "application_send_batch_formation",
    "decisionSequence": 2,
    "recordKind": "packet_plan",
    "operationKey": null,
    "planKey": "plan-1",
    "forcedValue": "single_eligible",
    "selectedValue": "single_eligible",
    "appliedValue": "single_eligible",
    "sourceArtifactPath": "raw/batch-decision.json",
    "sourceArtifactSha256": "6666666666666666666666666666666666666666666666666666666666666666"
  },
  {
    "schemaVersion": "adaptive-runtime-stage1-axis-decision-v1",
    "epochRowId": "campaign-1|run-1|cell-1|sample-1|connection-1|0",
    "campaignId": "campaign-1",
    "runId": "run-1",
    "cellId": "cell-1",
    "sampleId": "sample-1",
    "connectionKey": "connection-1",
    "epochIndex": 0,
    "axisId": "queued_send_burst_budget",
    "decisionSequence": 3,
    "recordKind": "actor_turn",
    "operationKey": null,
    "planKey": null,
    "forcedValue": null,
    "selectedValue": "legacy_current",
    "appliedValue": "legacy_current",
    "sourceArtifactPath": "raw/burst-decision.json",
    "sourceArtifactSha256": "7777777777777777777777777777777777777777777777777777777777777777"
  },
  {
    "schemaVersion": "adaptive-runtime-stage1-axis-decision-v1",
    "epochRowId": "campaign-1|run-1|cell-1|sample-1|connection-1|0",
    "campaignId": "campaign-1",
    "runId": "run-1",
    "cellId": "cell-1",
    "sampleId": "sample-1",
    "connectionKey": "connection-1",
    "epochIndex": 0,
    "axisId": "oversized_write_admission_quantum",
    "decisionSequence": 4,
    "recordKind": "logical_write",
    "operationKey": "write-1",
    "planKey": null,
    "forcedValue": null,
    "selectedValue": "legacy_current",
    "appliedValue": "legacy_current",
    "sourceArtifactPath": "raw/oversized-write-decision.json",
    "sourceArtifactSha256": "8888888888888888888888888888888888888888888888888888888888888888"
  }
]
